{
  "version": 1,
  "updated_at": "2026-10-23",
  "description": "Catalog of the language models used by AgentDoc: what each model accepts. Data gathered on 22 October 2026 from provider documentation and with test calls. Where a value was not measured it is null and the note says so.",
  "reasoning_levels": ["none", "minimal", "low", "medium", "high", "xhigh", "max"],
  "temperature_policies": ["always", "when_reasoning_off", "never"],
  "models": [
    {
      "provider": "anthropic",
      "model_id": "claude-fable-5-1",
      "aliases": [],
      "context_window": 1000000,
      "max_output_tokens": 128000,
      "reasoning_levels": ["low", "medium", "high", "xhigh", "max"],
      "reasoning_default": "high",
      "reasoning_off": null,
      "temperature_policy": "never",
      "temperature_recommended": null,
      "reads_pdf": true,
      "notes": "Reasoning cannot be turned off. With API version 2026-10-21, temperature, top_p and top_k return 400 even at the default value."
    },
    {
      "provider": "anthropic",
      "model_id": "claude-opus-5-5",
      "aliases": [],
      "context_window": 1000000,
      "max_output_tokens": 128000,
      "reasoning_levels": ["low", "medium", "high", "xhigh", "max"],
      "reasoning_default": "medium",
      "reasoning_off": null,
      "temperature_policy": "never",
      "temperature_recommended": null,
      "reads_pdf": true,
      "notes": "Reasoning cannot be turned off. Default medium, one level below the other Claude models."
    },
    {
      "provider": "anthropic",
      "model_id": "claude-sonnet-5-5",
      "aliases": [],
      "context_window": 1000000,
      "max_output_tokens": 128000,
      "reasoning_levels": ["none", "low", "medium", "high", "xhigh", "max"],
      "reasoning_default": "high",
      "reasoning_off": "between_tools",
      "temperature_policy": "never",
      "temperature_recommended": null,
      "reads_pdf": true,
      "notes": "The none level is sent as thinking between_tools, allowed only with level high or lower."
    },
    {
      "provider": "anthropic",
      "model_id": "claude-haiku-5-5",
      "aliases": [],
      "context_window": 1000000,
      "max_output_tokens": 128000,
      "reasoning_levels": ["none", "low", "medium", "high", "xhigh", "max"],
      "reasoning_default": "medium",
      "reasoning_off": "disabled",
      "temperature_policy": "never",
      "temperature_recommended": null,
      "reads_pdf": true,
      "notes": "The none level is sent as thinking disabled, allowed only with level high or lower."
    },
    {
      "provider": "openai",
      "model_id": "gpt-6-astra",
      "aliases": [],
      "context_window": 1050000,
      "max_output_tokens": 128000,
      "reasoning_levels": ["low", "medium", "high", "xhigh", "max"],
      "reasoning_default": "medium",
      "reasoning_off": null,
      "temperature_policy": "never",
      "temperature_recommended": null,
      "reads_pdf": true,
      "notes": "Temperature rejected with 400 (measured). Default read from the Responses API."
    },
    {
      "provider": "openai",
      "model_id": "gpt-6.1-sol",
      "aliases": [],
      "context_window": 1050000,
      "max_output_tokens": 128000,
      "reasoning_levels": ["low", "medium", "high", "xhigh", "max"],
      "reasoning_default": "medium",
      "reasoning_off": null,
      "temperature_policy": "never",
      "temperature_recommended": null,
      "reads_pdf": true,
      "notes": "Temperature rule inferred from astra, not measured."
    },
    {
      "provider": "openai",
      "model_id": "gpt-6-luna",
      "aliases": [],
      "context_window": 1050000,
      "max_output_tokens": 128000,
      "reasoning_levels": ["none", "low", "medium", "high", "xhigh", "max"],
      "reasoning_default": "medium",
      "reasoning_off": null,
      "temperature_policy": "when_reasoning_off",
      "temperature_recommended": null,
      "reads_pdf": true,
      "notes": "The none level is an ordinary value of the parameter. Temperature is accepted only with none (measured)."
    },
    {
      "provider": "gemini",
      "model_id": "gemini-4-argon",
      "aliases": [],
      "context_window": 1048576,
      "max_output_tokens": 65536,
      "reasoning_levels": ["low", "medium", "high"],
      "reasoning_default": "medium",
      "reasoning_off": null,
      "temperature_policy": "always",
      "temperature_recommended": 1.0,
      "reads_pdf": true,
      "notes": "Default estimated from reasoning tokens (three trials per level). minimal returns 400. Google recommends temperature 1.0: below that the model can loop."
    },
    {
      "provider": "gemini",
      "model_id": "gemini-3.8-flash",
      "aliases": [],
      "context_window": 1048576,
      "max_output_tokens": 65536,
      "reasoning_levels": ["low", "medium", "high"],
      "reasoning_default": "medium",
      "reasoning_off": null,
      "temperature_policy": "always",
      "temperature_recommended": 1.0,
      "reads_pdf": true,
      "notes": "Default estimated from reasoning tokens. minimal returns 400."
    },
    {
      "provider": "gemini",
      "model_id": "gemini-3.5-flash-lite",
      "aliases": [],
      "context_window": null,
      "max_output_tokens": 65536,
      "reasoning_levels": ["minimal", "low", "medium", "high"],
      "reasoning_default": "minimal",
      "reasoning_off": null,
      "temperature_policy": "always",
      "temperature_recommended": 1.0,
      "reads_pdf": true,
      "notes": "Context not measured. With minimal it does not reason (zero reasoning tokens)."
    },
    {
      "provider": "gemini",
      "model_id": "gemini-3.1-pro-preview",
      "aliases": [],
      "context_window": 1048576,
      "max_output_tokens": 65536,
      "reasoning_levels": ["low", "medium", "high"],
      "reasoning_default": "high",
      "reasoning_off": null,
      "temperature_policy": "always",
      "temperature_recommended": 1.0,
      "reads_pdf": true,
      "notes": "Default estimated, with uncertainty. minimal returns 400."
    },
    {
      "provider": "mistral",
      "model_id": "mistral-large-4-0",
      "aliases": [],
      "context_window": 1048576,
      "max_output_tokens": 262144,
      "reasoning_levels": ["none", "high"],
      "reasoning_default": "high",
      "reasoning_off": null,
      "temperature_policy": "always",
      "temperature_recommended": null,
      "reads_pdf": true,
      "notes": "Public preview since 6 October 2026. With reasoning on, the response is a list of blocks (thinking and text). mistral-large-latest does NOT point to this model."
    },
    {
      "provider": "mistral",
      "model_id": "mistral-medium-3-5",
      "aliases": ["mistral-medium-latest"],
      "context_window": 262144,
      "max_output_tokens": null,
      "reasoning_levels": ["none", "high"],
      "reasoning_default": "none",
      "reasoning_off": null,
      "temperature_policy": "always",
      "temperature_recommended": null,
      "reads_pdf": true,
      "notes": "Maximum output not measured."
    },
    {
      "provider": "mistral",
      "model_id": "mistral-small-latest",
      "aliases": ["mistral-small-2603"],
      "context_window": 262144,
      "max_output_tokens": null,
      "reasoning_levels": ["none", "high"],
      "reasoning_default": "none",
      "reasoning_off": null,
      "temperature_policy": "always",
      "temperature_recommended": null,
      "reads_pdf": true,
      "notes": "Small 4. Maximum output not measured."
    },
    {
      "provider": "mistral",
      "model_id": "mistral-large-latest",
      "aliases": ["mistral-large-2512"],
      "context_window": 262144,
      "max_output_tokens": null,
      "reasoning_levels": [],
      "reasoning_default": null,
      "reasoning_off": null,
      "temperature_policy": "always",
      "temperature_recommended": null,
      "reads_pdf": true,
      "notes": "Large 3: does not reason. Sending reasoning_effort returns 400. Maximum output not measured."
    }
  ]
}
